{
  "schemaVersion": "0.1.0",
  "updatedAt": "2026-07-19",
  "coordinateOrder": "[longitude, latitude]",
  "sourcePolicy": "MBDB is the primary source for official names, classifications and reference coordinates.",
  "scopeNoteZh": "面向初级爱好者的精选学习数据集，当前聚焦铁陨石与橄榄陨铁，不代表全球陨石完整名录。",
  "contentLicense": "CC BY 4.0 applies to original editorial text and data structure; cited source material retains its original terms.",
  "meteorites": [
    {
      "id": "aletai",
      "name": {
        "zh": "阿勒泰",
        "en": "Aletai"
      },
      "aliases": [
        "阿尔曼提",
        "Armanty",
        "Xinjiang"
      ],
      "category": "iron",
      "categoryZh": "铁陨石",
      "classification": "IIIE-an, coarse octahedrite",
      "event": {
        "kind": "find",
        "year": 1898,
        "labelZh": "1898年首块发现"
      },
      "location": {
        "countryZh": "中国",
        "regionZh": "新疆阿勒泰",
        "coordinates": [
          90.5047,
          45.8711
        ],
        "coordinateRole": "散布区代表点"
      },
      "map": {
        "coverage": {
          "kind": "line",
          "confidence": "reported-extent",
          "points": [
            [
              91.4025,
              44.9567
            ],
            [
              88.2762,
              48.1042
            ]
          ],
          "dimensions": {
            "majorAxisKm": 430,
            "minorAxisKm": null,
            "radiusKm": null,
            "areaKm2": null
          },
          "dimensionStatus": "reported",
          "boundaryConfidence": "medium",
          "descriptionZh": "资料报道至少430公里的东南至西北散布主轴。虚线只表示已报道的轴线，不代表完整边界。"
        }
      },
      "summaryZh": "至少五块主要碎体的总质量超过74吨。研究者依据成分和内部结构把它们归为同一母体，是讲解长期散布场、命名更新和铁陨石维德曼花纹的中国起点。",
      "image": {
        "status": "curated",
        "searchTerms": [
          "Aletai meteorite",
          "Armanty meteorite"
        ]
      },
      "sources": [
        {
          "title": "Meteoritical Bulletin Database: Aletai",
          "url": "https://www.lpi.usra.edu/meteor/metbull.php?code=64400"
        },
        {
          "title": "Aletai meteorite shower research",
          "url": "https://pmc.ncbi.nlm.nih.gov/articles/PMC9232108/"
        }
      ]
    },
    {
      "id": "hoba",
      "name": {
        "zh": "霍巴",
        "en": "Hoba"
      },
      "aliases": [
        "Hoba West"
      ],
      "category": "iron",
      "categoryZh": "铁陨石",
      "classification": "IVB iron meteorite",
      "event": {
        "kind": "find",
        "year": 1920,
        "labelZh": "1920年发现"
      },
      "location": {
        "countryZh": "纳米比亚",
        "regionZh": "Otjozondjupa, Hoba West农场",
        "coordinates": [
          17.9336,
          -19.5925
        ],
        "coordinateRole": "原地保存地点"
      },
      "map": {
        "coverage": {
          "kind": "point",
          "confidence": "official-coordinate",
          "descriptionZh": "单体原地保存，不以散布区表示。"
        }
      },
      "summaryZh": "质量超过60吨，至今未被搬离原处，是地表最大的完整单体陨石。它由铁镍合金组成，不是橄榄陨铁，适合用来说明科学分类与市场俗称的区别。",
      "image": {
        "status": "curated",
        "searchTerms": [
          "Hoba meteorite Namibia"
        ]
      },
      "sources": [
        {
          "title": "Meteoritical Bulletin Database: Hoba",
          "url": "https://www.lpi.usra.edu/meteor/metbull.php?code=11890"
        }
      ]
    },
    {
      "id": "gibeon",
      "name": {
        "zh": "基贝恩",
        "en": "Gibeon"
      },
      "aliases": [
        "Gibeon meteorite"
      ],
      "category": "iron",
      "categoryZh": "铁陨石",
      "classification": "IVA, fine octahedrite",
      "event": {
        "kind": "find",
        "year": 1836,
        "labelZh": "1836年首次科学采集"
      },
      "location": {
        "countryZh": "纳米比亚",
        "regionZh": "Hardap, 基贝恩附近",
        "coordinates": [
          18,
          -25.3333
        ],
        "coordinateRole": "散布区代表点"
      },
      "map": {
        "coverage": {
          "kind": "ellipse",
          "confidence": "reported-extent",
          "dimensions": {
            "majorAxisKm": 390,
            "minorAxisKm": 120,
            "radiusKm": null,
            "areaKm2": null
          },
          "dimensionStatus": "reported",
          "boundaryConfidence": "low",
          "descriptionZh": "研究资料对散布场长轴存在不同说法，主页面默认不显示此椭圆；研究图层可用虚线显示390乘120公里的概括范围。"
        }
      },
      "summaryZh": "纳马人早已使用其金属制作工具，后来才被科学界确认。它的切面以细密维德曼花纹著称，温得和克有公共展示，是纳米比亚的重要地图点。",
      "image": {
        "status": "curated",
        "searchTerms": [
          "Gibeon meteorite Widmanstatten"
        ]
      },
      "sources": [
        {
          "title": "Meteoritical Bulletin Database: Gibeon",
          "url": "https://www.lpi.usra.edu/meteor/metbull.php?code=10912"
        },
        {
          "title": "Aletai meteorite shower research, comparative discussion",
          "url": "https://pmc.ncbi.nlm.nih.gov/articles/PMC9232108/"
        }
      ]
    },
    {
      "id": "campo-del-cielo",
      "name": {
        "zh": "天空之原",
        "en": "Campo del Cielo"
      },
      "aliases": [
        "坎波德尔谢洛",
        "Field of the Sky"
      ],
      "category": "iron",
      "categoryZh": "铁陨石",
      "classification": "IAB-MG iron meteorite",
      "event": {
        "kind": "find",
        "year": 1576,
        "labelZh": "1576年前已有记载，坠落约4000至5000年前"
      },
      "location": {
        "countryZh": "阿根廷",
        "regionZh": "Chaco与Santiago del Estero省",
        "coordinates": [
          -61.7,
          -27.6333
        ],
        "coordinateRole": "散布区代表点"
      },
      "map": {
        "coverage": {
          "kind": "ellipse",
          "confidence": "reported-extent",
          "dimensions": {
            "majorAxisKm": 18.5,
            "minorAxisKm": 3,
            "radiusKm": null,
            "areaKm2": null
          },
          "dimensionStatus": "reported",
          "boundaryConfidence": "medium",
          "descriptionZh": "18.5乘3公里是核心陨石坑区的报告范围；小碎片可延至约60公里，不能把60公里视作确定边界。"
        }
      },
      "summaryZh": "名称意为“天空之原”。多块铁质碎体和陨石坑构成著名散布场，其中包括大型Gancedo质量，适合解释一次陨石雨为何会留下多个坑与可收藏碎块。",
      "image": {
        "status": "curated",
        "searchTerms": [
          "Campo del Cielo meteorite Gancedo"
        ]
      },
      "sources": [
        {
          "title": "Meteoritical Bulletin Database: Campo del Cielo",
          "url": "https://www.lpi.usra.edu/meteor/metbull.php?code=5247"
        },
        {
          "title": "LPSC: Campo del Cielo strewnfield study",
          "url": "https://www.lpi.usra.edu/meetings/lpsc2006/pdf/1102.pdf"
        }
      ]
    },
    {
      "id": "sikhote-alin",
      "name": {
        "zh": "锡霍特-阿林",
        "en": "Sikhote-Alin"
      },
      "aliases": [
        "Sikhote Alin"
      ],
      "category": "iron",
      "categoryZh": "铁陨石",
      "classification": "IIAB iron meteorite",
      "event": {
        "kind": "observed_fall",
        "year": 1947,
        "labelZh": "1947年2月12日目击坠落"
      },
      "location": {
        "countryZh": "俄罗斯",
        "regionZh": "滨海边疆区锡霍特-阿林山地",
        "coordinates": [
          134.6533,
          46.16
        ],
        "coordinateRole": "坠落散布区代表点"
      },
      "map": {
        "coverage": {
          "kind": "circle",
          "confidence": "editorial-approximation",
          "dimensions": {
            "majorAxisKm": null,
            "minorAxisKm": null,
            "radiusKm": 0.64,
            "areaKm2": 1.3
          },
          "dimensionStatus": "estimated",
          "boundaryConfidence": "medium",
          "descriptionZh": "资料报告散布区面积约1.3平方公里；0.64公里半径为等面积圆换算，仅用于示意，不能当作实测圆形边界。"
        }
      },
      "summaryZh": "白昼火球、爆炸和随后陨石雨都有目击记录，回收总量超过23吨。碎片常保留气印与熔壳，是展示大气破碎、个体陨石和爆炸型陨石雨的标志性事件。",
      "image": {
        "status": "curated",
        "searchTerms": [
          "Sikhote-Alin meteorite shrapnel"
        ]
      },
      "sources": [
        {
          "title": "Meteoritical Bulletin Database: Sikhote-Alin",
          "url": "https://www.lpi.usra.edu/meteor/metbull.php?code=23593"
        }
      ]
    },
    {
      "id": "canyon-diablo",
      "name": {
        "zh": "魔鬼峡谷",
        "en": "Canyon Diablo"
      },
      "aliases": [
        "Meteor Crater meteorite"
      ],
      "category": "iron",
      "categoryZh": "铁陨石",
      "classification": "IAB-MG iron meteorite",
      "event": {
        "kind": "find",
        "year": 1891,
        "labelZh": "1891年发现，撞击约发生于4.9万年前"
      },
      "location": {
        "countryZh": "美国",
        "regionZh": "亚利桑那州Coconino County, Meteor Crater附近",
        "coordinates": [
          -111.0333,
          35.05
        ],
        "coordinateRole": "撞击坑相关发现地"
      },
      "map": {
        "coverage": {
          "kind": "point",
          "confidence": "official-coordinate",
          "descriptionZh": "此点用于关联Meteor Crater，不等同于单一陨石碎片位置。"
        }
      },
      "summaryZh": "它与著名的Barringer Meteor Crater相关，碎块是研究地球撞击坑的关键证据。初学者可通过它理解：陨石名称取发现地，而撞击坑可能另有通名。",
      "image": {
        "status": "curated",
        "searchTerms": [
          "Canyon Diablo meteorite Meteor Crater"
        ]
      },
      "sources": [
        {
          "title": "Meteoritical Bulletin Database: Canyon Diablo",
          "url": "https://www.lpi.usra.edu/meteor/metbull.php?code=5257"
        }
      ]
    },
    {
      "id": "cape-york",
      "name": {
        "zh": "开普约克",
        "en": "Cape York"
      },
      "aliases": [
        "Ahnighito",
        "Tent",
        "Woman"
      ],
      "category": "iron",
      "categoryZh": "铁陨石",
      "classification": "IIIAB iron meteorite",
      "event": {
        "kind": "find",
        "year": null,
        "labelZh": "因纽特人约千年前已知，19世纪有科学记录"
      },
      "location": {
        "countryZh": "格陵兰",
        "regionZh": "Avannaata",
        "coordinates": [
          -64.9333,
          76.1333
        ],
        "coordinateRole": "发现地区代表点"
      },
      "map": {
        "coverage": {
          "kind": "multi-point",